noisy_text,clean_text
ไปจองมาแล้วนาจา Mitsubishi Attrage ได้หลังสงกรานต์เลย รอขับอยู่นาจา กระทัดรัด เหมาะกับสาวๆขับรถคนเดียวแบบเรา ราคาสบายกระเป๋า ประหยัดน้ำมัน วิ่งไกลแค่ไหนหายห่วงค่ะ,ไปจองมาแล้วนาจา Mitsubishi Attrage ได้หลังสงกรานต์เลย รอขับอยู่นาจา กะทัดรัด เหมาะกับสาวๆๆขับรถเดียวแบบเรา ราคาสบายกระเป๋า ประหยัดน้ำมัน วิ่งไกลแค่ไหนหายหัวค่ะ
เปิดศักราชใหม่! นายกฯ แถลงข่าวก่อนการแข่งขันศึก #ช้างเอฟเอคัพ นัดชิงชนะเลิศ,เปิดศักราชใหม่! นายก แถลงข่าวก่อนการแข่งขันศึก #ช้างเอฟเอคัพ นัดชิงชนะเลิศ
บัตรสมาชิกลดได้อีกไหมคับ,บัตรสมาชิกลดได้อีกไหมคับ
สนใจ new mazda2ครับ,สนใจ new mazda2ครับ
😍😍,😍😍
"พอๆกับ, Juke : รถอะไรวะ ทรงประหลาด CHR : สวย ล้ำ คุ้ม","พอๆๆกับ, Juke : รถอะไรวะ ทรงประหลาด CHR : สวย ล้ำ คุ้ม"
张丽霞 อ้อออ ผ้าอนามัยแบบสอดอ่ะนะ กุกลัวมาก 5555555,张丽霞 อ้อ ผ้าอนามัยแบบสอดอ่ะนะ กุกลัวมาก 5
เออน่ากินนนน,เออห่ากิน
ไม่ขอบสีโทนนี้แล้ว ไปชอบโทน tarte bloom หยั่กดั้ยมากกก,ไม่ขอบสีโทนนี้แล้ว ไปชอบโทน tarte bloom หยั่กดั้ยมาก
ไปจับบุหรี่ไฟฟ้าในคลิป ตำรวจเป็น10คนได้ละมั่ง ผู้หญิงคนเดียว ตลกดี ของกลางบุหรี่ไฟฟ้า เป็นอันตรายต่อประเทศชาติอย่างรุนแรง อาจทำให้น้ำท่วม พายุได้,ไปจับบุหรี่ไฟฟ้าในคลิป ตำรวจเป็น10คนได้ละมั่ง ผู้หญิงเดียว ตลกดี ของกลางบุหรี่ไฟฟ้า เป็นอันตรายต่อประเทศชาติอย่างรุนแรง อาจทำให้น้ำท่วม พายุได้
เหมาะกะมึงที่สัสคะ เอ้ย สุด,เหมาะกะมึงที่สัสคะ เอ้ย สุด
กรองน้ำมันเกียร์ Swift มีอยู่ในเกียร์ทั้งกรองหยาบและกรองละเอียด แต่ไม่มีอะไหล่ให้เบิกเนื่องจากซัพพลายเออร์บอกว่าใช้ได้ตลอดอายุเกียร์ ผมเชื่อว่าไม่มีทางที่มันจะอยู่ได้นานขนาดนั้นและบอกความเห็นไปทาง Suzuki แล้วว่าควรทำให้สามารถเบิกจากศูนย์ได้,กรองน้ำมันเกียร์ Swift มีอยู่ในเกียร์ทั้งกรองหยาบและกรองละเอียด แต่ไม่มีอะไหล่ให้เบิกเนื่องจากซัพพลายเออร์บอกว่าใช้ได้ต่ออายุเกียร์ ผมเชื่อว่าไม่ทางที่มันจะอยู่ได้นานขนาดนั้นและบอกความเร็วไปทาง Suzuki แล้วว่าควรทำให้สามารถเบิกจากศูนย์ได้
เออ ข่าวบาบีก้อนอะที่เค้าบอกกันว่าถ้าสุกก็กินได้ คือพยาธิตายยังไงอะ แบบสลายหายไปเลยหรือเป็นซากอะ ถ้าเป็นซากก็กินไม่ไหวนะ 😂,เออ ข่าวบาบีก้อนอะที่เค้าบอกกันว่าถ้าสุกก็กินได้ คือพยาธิตายยังไงอะ แบบสลายหายไปเลยหรือเป็นซากอะ ถ้าเป็นซากก็กินไม่ไหวนะ 😂
นึกว่า Subaru XV ฮ่าๆ 😂,นึกว่า Subaru XV ฮ่าๆๆ 😂
"ใหม่! Precious Mineral Compact SPF30/PA++ แป้งฝุ่นอัดแข็งมัลติฟังก์ชั่น ปกปิดเป๊ะ ความคุมมัน ติดทนนาน ให้คุณได้ผิวสวยเรียบเนียนตลอดวัน มาพร้อมพัฟ 2 สัมผัส ให้คุณสวยได้ 2 สไตล์ในตลับเดียว ช้อปเลยที่ETUDE HOUSE ทุกสาขา📍 - เซ็นเตอร์พอยท์ ออฟ สยามสแควร์, ชั้น 3 (โทร. 02-222-2222) - เซ็นทรัลพลาซ่า พระราม 2, ชั้น 1 (โทร. 02222-2222) - สยามเซ็นเตอร์, ชั้น M (โทร. 02222-2222) - แฟชั่นไอส์แลนด์, ชั้น 2 (โทร. 02-222-2222) - เซ็นทรัลพลาซา เวสต์เกต ชั้น 2 (เปิดบริการวันที่ 5 เมษายน) 🛒 ช้อปออนไลน์ของแท้ 100% ได้ที่ http://bit.ly/ETUDEatLazada 🔍 ดูข้อมูลสินค้าเพิ่มเติมได้ที่ www.etudehouse.com ⭐️ เป็นเพื่อนกับเราที่ Line@ @etudehousethailand หรือคลิก http://line.me/ti/p/~@etudehousethailand","ใหม่! Precious Mineral Compact SPF30/PA++ แป้งฝุ่นอัดแข็งมัลติฟังก์ชั่น ปกปิดเป๊ะ ความคุมมัน ติดทนนาน ให้คุณได้ผิวสวยเรียบเนียนตลอดจน มาพร้อมพัฟ 2 สัมผัส ให้คุณสวยได้ 2 สไตล์ในตลับเดียว ช้อปเลยที่ETUDE HOUSE ทุกสาขา📍 - เซ็นเตอร์พอยท์ ออฟ สยามสแควร์, ชั้น 3 (โทร. 02-2-2) - เซ็นทรัลพลาซ่า พระยา 2, ชั้น 1 (โทร. 02-2) - สยามเซ็นเตอร์, ชั้น M (โทร. 02-2) - แฟชั่นไอส์แลนด์, ชั้น 2 (โทร. 02-2-2) - เซ็นทรัลพลาซา เวสต์เกตน ชั้น 2 (เปิดบริการวันที่ 5 เมษายน) 🛒 ช้อปออนไลน์ของใช้ 100% ได้ที่ http://bit.ly/ETUDEatLazada 🔍 ดูข้อมูลสินค้าเพิ่มเติมได้ที่ w.etudehouse.com ⭐️ เล่นเพื่อนกับเราที่ Line@ @etudehousethailand หรือคลิก http://line.me/ti/p/~@etudehousethailand"
สู้ๆนะคร้าฟผมๆๆๆๆๆ,สู้ๆๆนะคนร้าผม
ได้ท้ายแอคคอร์ดเลย,ได้ท้ายคองคอร์ดเลย
2 วันสุดท้าย ยังไงคะลูกสาว,2 วันสุดท้าย ยังไงคะลูกสาว
ขอบคุณคะ,ขอบคุณคะ
ผ่อนบาทเดือนละ1400ไจ่ก่อ,ผ่อนบาทเดือนละ1400ไม่ก่อ
"ญาติพี่น้อง ลึกๆ ก็รักกันป่ะวะเค้าถึงมารวมญาติกัน ไม่ได้เกลียดกัน มันจะกระอักกระอ่วนอะไรขนาดนั้น แล้วถ้าจะไม่ให้ญาติผู้ใหญ่ทักเรื่องส่วนตัวเรียนอะไรเกรดเท่าไรทำงานอะไร จะให้เค้าถามอะไร ""ว่าไงลูก ปีนี้มี followers ในทวิตเตอร์กี่คนแล้ว"" หรา","ญาติพี่น้อง ลึกๆๆ ก็รักกันป่ะวะเค้าถึงมารวมญาติกัน ไม่ได้เกลียดกัน มันจะกระอักกระอ่วนอะไรขนาดนั้น แล้วถ้าจะไม่ให้ญาติผู้ใหญ่ทักเรื่องส่วนตัวเรียนอะไรเกรดเท่าไรทำงานอะไร จะให้เค้าถามอะไร ""ว่าไงลูก ปีนี้มี followers ในวิกเตอร์กี่คนแล้ว"" หรา"
อยากให้ดันเรื่องให้ผ่านไวๆจังครับ ตอนนี้รู้สึกอึดอัดมาก,อยากให้ดันเรื่องให้ผ่านไวๆๆจังครับ ตอนนี้รู้สึกอึดอัดมาก
ได้เลย ที่รัก รองดูไว้ก่อนเลย 💕,ได้เลย ที่รัก รองดูไว้ก่อนเลย 💕
การบริการเริ่มแย่ลงทุกวัน เดินเข้าสาขาซีคอนสแควร์ชั้นใต้ดิน ส่งลูกค้ามานั่งโต๊ะ แต่โต๊ะยังไม่เก็บ แก้วนน้ำใช้แล้ววางอยู่ เต็มไปหมด เรียกพนักงานไม่มีใครสนใจสักคน ทำไม่ได้ยิน ต้องไปเรียกคนที่ใส่สูทสีดำมา ถึงได้เรื่อง บะหมี่หยก2ก้อนฟรี บอกไม่ได้ต้องลงทะเบียนต่อหน้าพนักงาน คุณควรแจ้งตั้งแต่แรก ไม่ใช่ทำแล้วบอกต้องทำใหม่ สรุป เสียเงินง่ายกว่าเยอะ มากินก็บ่อย ของอะไรที่เป็นโปรโมชั่นมักจะยากกับลูกค้าเสมอ ฝากmkปรับปรุงการบริการด้วยนะค่ะ,การบริการเริ่มแย่ลงทุกหน เดินเข้าสาขาซีคอนสแควร์ชั้นใต้ดิน ส่งลูกค้ามานั่งโต๊ะ แต่โต๊ะยังไม่เก็บ แก้วนน้ำใช้แล้ววางอยู่ เต็มไปหมด เรียกพนักงานไม่มีใครสนใจสักคน ทำไม่ได้ยิน ต้องไปเรียกคนที่ใส่สูทสีดำมา ถึงได้เรื่อง บะหมี่หยก2ก้อนฟรี บอกไม่ได้ต้องลงทะเบียนต่อหน้าพนักงาน คุณควรแจ้งตั้งแต่แรก ไม่ใช่ทำแล้วบอกต้องทำใหม่ สรุป เสียเถิดง่ายกว่าเยอะ มากินก็บ่อย ของอะไรที่เป็นโปรโมชั่นมัจจะยากกับลูกค้าเสมอ ฝากmkปรับปรุงการบริการด้วยนะค่ะ
นัดต่อไป เรือต่อ2เม็ดฯ เล่น เบียร์สิงห์ 2หลัง,นัดต่อไป เรื่อ2เม็ดฯฯ เล่น เบียร์สิงห์ 2หลัง
กำนี้กินช้างเน้อ,กำนี้กินช้างเน้อ
ถ้าจะจับบุหรี่ไฟฟ้า ไปจับหวยก่อน กูเดือดร้อน,ถ้าจะจับบุหรี่ไฟฟ้า ไปจับหวยก่อน กูเดือดร้อน
เบียร์ช้างบูด หัวใจต๊ะติ๊งโหน่ง เค้าบอกให้ tag 1 คน 🤣🤣🤣,เบียร์ช้างบูด หัวใจต๊ะติ๊งโหน่ง เค้าบอกให้ tag 1 คน 🤣
ไม่ได้อยากกินเลยจริงๆ,ไม่ได้อยากกินเลยจริง
ทำไมรถฟอร์ดไม่ใส่ ครีบฉลาม Shark Fin มาให้ด้วยนะ,ทำไมรถฟอร์ดไม่ใส่ ครีบฉลาม Shark Fin มาให้ด้วยนะ
เมื่อถามจีน่าว่าบิวตี้บุฟเฟ่มีโปรไหม??,เมื่อถามจีน่าว่าบิตี้บุเฟ่มีโปรไหม??
ประเทศไทยอยากได้อะไรว่ามาเลย มันจะได้ถูกต้องชะที,ประเทศไทยยากไร้อะไรว่ามาเลย มันจะได้ถูกต้องชะที
ได้ไปสักที่ยัง5555,ได้ไปสักที่ยัง5
เพื่อนผมโดนตีไก่ 70000 ไม่ต้องขึ้นศาล จบที่สน.,เพื่อนผมโดนตีไก่ 70 มะต้องขึ้นคาน จบที่สน.
เสียดายบาบีกอนมื้อนั้นเหมือนกันนะ,เสียดายบาบีกอในมื้อนั้นเหมือนกับนะ
ใช้ดีแมคยังไม่ขนาดนี้,ใช้ดีแมคยังไม่ขนาดนี้
แบ๊วสัส เมื่อคืนตายย้อนแดกเบียร์ช้าง,แบ๊วสัส เมื่อคืนตายย้อนแดกเบียร์ช้าง
อยู่เมืองชลบุรีแป้งเจ้านางซื้อได้ที้ไหนคะ,อยู่เมืองบุรีแป้งเจ้านางซื้อได้ที้ไหนะ
ขี้เกียจอ่าน เหลามาเลย,ขี้เกียจอ่าน เหลามาเลย
สำหรับโตโยต้า ได้แค่นี้,สำหรับโตโยต้า ได้แค่นี้
ค้นพบแล้วว่าแดก285ไม่ได้จริงๆ...,ค้นพบแล้วว่าแดก285ไม่ได้จริง.
จองสิทธิ์ #โปรเจคเบลล่า เพียง300บาท❗️ ได้มากกว่าที่คิด สายเปย์สุดๆก็ WINKWHITE นี่แหละค่าา 🔥มีโค้ชสอนฟรี 🔥ได้meet&greet กับ พี่หมื่น หมื่นเรือง แม่การะเกด 🔥มีสิทธิ์ลุ้นรถฮอนด้าแจ๊ส 🔥สะสมโปร แลกของมากมาย ฟรี ทอง แบรนด์เนม รถ ศัลยกรรม ก็ฟรี ❗️ จองเลยตอนนี้ มีสิทธิมากมาย #ติดต่อได้ที่ ↬ 🆔 loukked28 http://line.me/ti/p/mQ1-o4-hqm http://line.me/ti/p/mQ1-o4-hqm http://line.me/ti/p/mQ1-o4-hqm,จองสิทธิ์ #โปรเจคท์เบลล่า เพียง300บาท❗️ ได้หากว่าที่คิด สายเปย์สุดๆๆก็ WINKWHITE นี่แหละค่ามา 🔥มีโค้ชสอนฟรี 🔥ได้meet&greet กับ พี่หมื่น หมื่นเรือง แม่การะเกด 🔥สิทธิ์ลุ้นรถแพนด้าแจ๊ส 🔥สะสมโปร แลกของมากมาย ฟรี ทอง แบรนด์เนม รถ ศัลยกรรม ก็ฟรี ❗️ จองเลยตอนนี้ มีสิทธิมากมาย #ติดต่อได้ที่ ↬ 🆔 loukked28 http://line.me/ti/p/mQ1-o4-hqm http://line.me/ti/p/mQ1-o4-hqm http://line.me/ti/p/mQ1-o4-hqm
อดสะมั้ง,อดสะมั้ง
โอ้ยแงน่ารักกกกก💕 อี้ชิงจะจุ้บหัวน้อยๆของมินซอกง่ะ55555555 ตอนแรกเหมือนจะแกล้งๆเป่าๆ มินซอกหันมาทำหน้าเหว๋อเลย เกิดอะไรขึ้นอ้ะมะกี้ สักพักจุ้บจริง ได้! จุ้บมาจุ้ยกลับ ไม่โกง!! แง น่ารักกกกกก มุมิมาก ทั้งคู่เลย😹💘✨,โอ้ยแงน่ารัก💕 อี้ชิงจะจุ้ยหัวน้อยๆๆของมิในซอกง่ะ5 ตอนแรกเหมือนจะแกล้งๆๆเป่าๆๆ มิในซอกหันตาทำหน้าเหอ๋อเลย เกิดอะไรขึ้นอ้ะมะกี้ สะพักจุ้ยจริง ได้! จุ้ยมาจุ้ยกลับ ไม่โกง!! แง น่ารัก มุมิมาก ทั้งคู่เลย😹💘✨
อีกนิดนะค่ะ พนักงานแคชเชียร์ลองพยายามหลายครั้งเหมือนกันค่ะ จนต้องขอโทษเค้าที่ทำให้เสียเวลา แค่อยากทราบว่ามันเกิดอะไรขึ้น ทำไมถึงชำระผ่านบัตรไม่ได้ และทำให้ไม่ได้ส่วนลดน่ะคะ,อีกนิดนะค่ะ พนักงานแคชเชียร์ลองพยายามหลายครั้งเหมือนกับค่ะ จนต้องขอโทษเค้าที่ทำให้เสียเวลา แค่อยากทราบว่ามันเกิดอะไรขึ้น ทำไมถึงชำระผ่านบัตรไม่ได้ และทำให้ไม่ได้ส่วนลดน่ะคะ
หู้ววววว,หิ้ว
มันเมา ขวดลีโอเสียบอยู่หน้ารถ เห็นกันไม๊ ? เบียร์วุ้นด้วย 555 ก็ถึงบอกไง หนีตามหน้าที่ 555 ถ้าโดนกระบองตี คริปนี้ไม่มีให้ดูแน่นอน,มันเมา ขวดลีโอเสียบอยู่หน้ารถ เห็นกันไม่ ? เบียร์วุ้นด้วย 5 ก็ถึงบอกไง หนีตามหน้าที่ 5 ถ้าโดนกระบองตี คนริไปนี้ไม่มีให้ดูแน่นอน
แม่หญิงใช้มิสทีน ซุปเปอร์แบล็ค ฟิคซ์ ไลเนอร์ เจ้าค่ะ อยากใช้ค่ะ อยากสวยเหมือนแม่หญิงการะเกด ถ้าแม่หญิงใช้อันไหน แสดงว่ามันต้องสุดๆไปเลยจริงๆค่ะ เขาเล่าลือว่าเส้นคมกริบ กรีดแล้วสวยไปสามบ้านแปดบ้านเลยนะออเจ้า แบ่งให้พี่ผินพี่แย้มใช้ด้วยนะค่ะแม่นาย มิสทีนใครใช้ก้สวยเจ้าค่ะ,แม่หญิงใช้สทีน ซุปเปอร์แบล็ค ฟิกซ์ ไมเนอร์ เจ้าคณะ อยากใช้ค่ะ อยากสวยเหมือนแม่หญิงการะเกด ถ้าแม่หญิงใช้อันไหน แสร้งว่ามันต้องสุดๆๆไปเลยจริงค่ะ เขาเล่าลือว่าเส้นคมกริบ กรีดแล้วสวยไปสามบ้านแปดบ้านเลยนะออเจ้า แบ่งให้พี่ผินพี่แย้มใช้ด้วยนะค่ะแม่นาย สทีนใครใช้ก็สวยเจ้าคณะ
ขนลุกมากตอนนี้ ยึกยือมาก บาบีก้อนไม่ปลอดภัยอีกต่อไป อ่านละคิดภาพตามอะ ควรกินแต่อาหารสุกๆท่องไว้ๆ,ขนลุกมากตอนนี้ ยึกยือมาก บาบีก้อนไม่ปลอดภัยอีกต่อไป อ่านละคิดภาพตามอะ ควรกินแต่อาหารสุกๆๆท่องไว้ๆๆ
คำชี้แจงของ ทูลกระหม่อมหญิงอุบลรัตน์ #ทรงพระสแลนด์เดอร์ #พรรคไทยรักษาชาติ,ชี้แจงของ ทูลกระหม่อมหญิงอุบลรัตน์ #ทรงพระสีแลนด์เดอร์ #พรรคไทยรักษาชาติ
อย่าเสือก เด๋วเหงือกสั่น ซีวิกคันแดง ขับอย่างนี้ 5555555555,อย่าเสือก เด๋วเหงือกสั่น ซีวิกคันแดง ขับอย่างนี้ 5
ไปกินนนกันมั้ยยยยย~,ไปกีดกันมั้ย~
อ้าวเห้ย,อ้าวเฮ้ย
เส้นใสๆ กรุบกรอบมากๆ,เส้นใสๆๆ กรุบกรอบมากๆๆ
ชวนกุกิน MK ก็พอแล้วเพื่อน,ชวนกุกิน MK ก็แล้วเพื่อน
ปะวันไหน,ปะวันไหน
ฉลากบอก scotหมดนะ,ฉลากบอก scotหมดนะ
พี่โน๊ตมีปัญหาหมอนรองกระดูก แต่ไปเซฟเฮีย ไม่รักได้ด้วยหรอ,พี่โน้ตปัญหาหมอนรองกระดูก แต่ไปเซฟเฮีย ไม่รักได้ด้วยหรอ
ประชาชาติ ฟันธง ศก.ไม่ดี - จีดีพีเทียม #NationTV,ประชาชาติ ฟัง ศก.ไม่ดี - จีพีเทียม #NationTV
