noisy_text,clean_text
เผยผิวเนียนสวยอย่างเป็นธรรมชาติด้วย IPSA Relaxed Day Foundation SPF25 PA++ รองพื้นสูตรใหม่ที่ให้ความสวยบางเบาแบบคุชชั่น เหมาะสำหรับช่วงซัมเมอร์อันร้อนแรง! www.hisoparty.com/beauty/beauty-new-arrivals/เผยผิวเนียนสวยอย่างเป็นธรรมชาติด้วย-ipsa-relaxed-day-foundation-spf25-pa #ipsa IPSA Thailand #IPSAThailand,เผยผิวเรียบสวยอย่างเป็นธรรมชาติด้วย IPSA Relaxed Day Foundation SPF25 PA++ รองพื้นสูตรใหม่ที่ให้ความสวยบางเบาแบบคุชั่น เหมาะสำหรับช่วงซัมเมอร์อันรุนแรง! w.hisoparty.com/beauty/beauty-new-arrivals/เผยผิวเรียบสวยอย่างเป็นธรรมชาติด้วย-ipsa-relaxed-day-foundation-spf25-pa #ipsa IPSA Thailand #IPSAThailand
#ฮอนด้าซิตี้ #เปลี่ยนมอเตอร์เซ็นทรัลล็อคใหม่กดรีโมทแล้วรถไม่ล็อคครับผม,#แพนด้าซิตี้ #เปลี่ยนมอเตอร์เซ็นทรัลล็อคใหม่กดรีโมทแล้วรถไม่ล็อคครับ
ฝนหยุดตกเเว้ว วันนี้มาชิลกับน้องๆสาวเบียร์ช้าง ตลาดหลบมุม Vintage night Barzaarขุขันธ์ ดึกๆค่อยม่วนกันต่อด้านในโซนโรงเบียร์จ้ะ,ฝนหยุดตกเอเว้วง วันนี้มาชิลกับน้องสาวเบียร์ช้าง ตลาดหลบมุม Vintage night Barzaarขุขันธ์ ดึกๆๆค่อยม่วนกันต่อด้านโซนโรงเบียร์จ้ะ
มันจะหมดเขตแล้วนะ,มันจะหมดเขตแล้วนะ
แอดมินขอทราบสาขาที่คุณลูกค้าเข้าใช้บริการเพื่อแจ้งให้ทางหัวหน้างานทราบด้วยนะคะ,ทอดมันขอทราบสาขาที่คุณลูกค้าเข้าใช้บริการเพื่อแจ้งให้ทางหัวหน้างานทราบด้วยมะคะ
สวยจังแต่ข่อยใช้รีโว่นะก้อประหยัดค่าน้ำมันดี,สวยจังแต่ข่อยใช้รีโว่นะก้อประหยัดค่าน้ำมันดี
กะเพราใส่ถั่วฝักยาวคือกะเพราที่แม่ค้าเบี่ยงเบนความสนใจจากการที่แม่ค้าใส่กะเพรากับหมูน้อย จำไว้ กะเพราต้องไม่ใส่ถั่วฝักยาว!!!!!!,กะเพราใส่ถั่วฝักยาวคือกะเพราที่แม่ค้าเบี่ยงเบนความสนใจจากการที่แม่ค้าใส่กะเพรากับหมูน้อย ไว้ กะเพราต้องไม่ใส่ถั่วฝักยาว!
"ฉลองวันเกิดลาซาด้าครบรอบ 6 ปี กับ อัพ ภูมิพัฒน์ !!! ขนแบรนด์ชั้นนำทั้ง Benefit, Vistra, Inisfree, Laneige และที่ขาดไม่ได้ Garnier นั้นเอง!!! . วันเดียว วันที่ 23 เม.ย. เวลา บ่าย 2 โมงตรง !!! อย่าลืมมาดูกันน้าาา ช้อป Lazada 25-27 เม.ย. ลดสูงสุด 90% >>> https://lzd.co/2qV2LGy","ฉลองบังเกิดลาซาด้าครอบ 6 ปี กับ อัพ ภูมิพัฒน์ ! ขนแบรนด์ชั้นนำทั้ง Benefit, Vistra, Inisfree, Laneige และที่ขาดไม่ได้ Garnier นั้นเอง! . วันเดียว วันที่ 23 เม.ย. เวลา บ่าย 2 โมงตรง ! อย่าลืมมาดูกันน้า ช้อป Lazada 25-27 เม.ย. ลดสูงสุด 90% > https://lzd.co/2qV2LGy"
ก่อนจะระเบิดความมันส์กับคอนเสิร์ต”เบียร์ช้าง” ที่อุบลฯ นางก็ต้องแวะมาเติมพลังปลาแดกที่ร้าน”แม่แมว” เป็นประจำ ได้ปลาแดกไปเต็มๆ คืนนี้มันส์แน่ๆ ใคร ‼️ใคร‼️ อยากสัมผัสความมันส์ สไตล์ ”ดาเอ็นโดรฟิน”กับขุมพลังปลาแดกของ”ส้มตำพรทิพย์” คือนี้เจอกันที่คอนเสิร์ต”เบียร์ช้าง”ข้างโรงแรมสุณีกันเลย!!! มันส์แน่นวล 😆😆😆,ก่อนจะระเบิดความมันส์กับคอนเสิร์ต”เบียร์ช้าง” ที่อุบล นางก็ต้องแวะมาเติมพลังปลาแดกที่ร้าน”แม่แมว” เป็นประจำ ได้ปลาแดกไปเต็ม วันนี้มันส์แน่ ใคร ‼️ใคร‼️ อยากสัมผัสความมันส์ สไตล์ ”ดาเอ็นโดรฟิน”กับขุมพลังปลาแดกของ”ส้มตำพรทิพย์” คือนี้เจอวันที่คอนเสิร์ต”เบียร์ช้าง”ข้างโรงแรมสุณีกันเลย! มันส์แน่นวล 😆
ถ้าเราไปก็แบบเปิดเบียร์ช้างในคอน,ถ้าเราไปก็แบบเปิดเบียร์ช้างในคอน
Mazda3 รุ่นปรับใหม่ อัดออพชั่นเพิ่มมากขึ้น เคาะราคา 8.57 แสนบาท – 1.149 ล้านบาท,Mazda3 รุ่นปรับใหม่ อัดออชั่นเพิ่มมากขึ้น เคาะราคา 8.57 แสนบาท – 1.149 ล้านบาท
💓โปรโมชั่นฮอต ลดยกเซ็ต ซ่อมผิวแก่ อวดความชุ่มชื่นรับหน้าร้อนกันได้ที่ร้าน Watsons ทุกสาขา ถึง 25 เม.ย. เท่านั้นนะคะ #HadaLaboAntiAgingLotion #1stStepAntiAging #โลชั่นซ่อมผิวแก่ #Promotion,💓โปรโมชั่นฮอต ลดยกเซ็ต ซ่อมผิวแก่ อวดความชุ่มชื่นรับหน้าร้านกันได้ที่ร้าน Watsons ทุกสาขา ถึง 25 เม.ย. เท่านั้นมะคะ #HadaLaboAntiAgingLotion #1stStepAntiAging #โลชั่นซ่อมผิวแก่ #Promotion
สวยเข้มทุกมุมมองครับ ส่วนเติ้ลธนพล หล่อเท่ห์มากครับ #ToyotaBuzz #เติ้ลธนพล,สวยเข้มทุกมุมมืดครับ ส่วนเติ้ลธนพล หล่อเท่ห์มากครับ #ToyotaBuzz #เติ้ลธนพล
#MKก็มีชาชีสแล้วนะรู้ยัง #รสชาติเป็นยังไงไปดูกัน 🧀 เป็นร้านสุกี้แนวครอบครัวที่ทุกคนรู้จัก แต่วันนี้เค้ามีโปรใหม่อย่างชาชีสสุดฮิต เราจึงต้องมาลอง ทางร้านมี 3 แบบ คือ สตรอเบอร์รี่ปั่นครีมชีส ชาไทยครีมชีส ชาเอิร์ลเกรย์ครีมชีส อันนี้สั่งแบบกลับบ้าน แก้วน่ารักมาก มีไม้หนวดปักด้วย ><ทุกคนลงมติว่าชาไทยครีมชีสอร่อยมาก รีบมาโดนกัน 📍MK Restaurants #foodstylistchannel,#MKก็มีชาชีสแล้วนะรู้ยัง #รสชาติเป็นยังไงไปด้กัน 🧀 เป็นร้านสุกี้แนวครอบครัวที่ทุกรู้จัก แต่วันนี้เค้ามีโปรใหม่อย่างชาชีสสุดฮิต เราจึงต้องมาลอง ทางร้านมี 3 แบบ คือ สตรอเบอร์รี่ปั่นครีมชีส ชาไทยครีมชีส ชาเอิร์ลเกรย์ครีมชีส วันนี้สั่งแบบกลับบ้าน แก้วน่ารักมาก มีไม้หนวดปักด้วย ><ทุกหนมติว่าชาไทยครีมชีสอร่อยมาก รีบมาโดนกัน 📍MK Restaurants #foodstylistchannel
อีดออกกก ฟังเพลงล้ะมีโฆษณาเอ็มเคชีสซิ๊ดเเซ่บคือเหี้ยใร,อีดีออก รังเพลิงละมีโฆษณาเอ็มเคชีสซิ๊ดเเซ่บคือเหี้ยใร
ไปถึงก็ชุดใหญ่ทุกที,ไปถึงก็ชุดใหญ่ทุกที
สรุป/ไม่อร่อย/ได้น้อย/แพง🙅,สรุป/ไม่อร่อย/ได้น้อย/แพง🙅
กี่โปร ... กี่โปร ก็ยังไปไม่ถึง,กี่โปร . กี่โปร ก็ยังไปไม่ถึง
ผม เดือนละ 700 100/30 ต้องไปแจ้งเรื่องเปลี่ยนแพ็คไหมคับ หรือ จะอัพให้อัติโนมัตเลย,ผม เดือนละ 700 100/30 ต้องไปแจ้งเรื่องเปลี่ยนแพ็คไหมคับ หรือ จะอัพให้อัติโนมัตเลย
ไม่กินกาแฟเลยไม่ชอบบรรยากาศสตาบัค คือนั่งอะนั่งได้แต่ไม่ค่อยจอยเพราะมีแต่กลิ่นกาแฟ ละเพื่อนคือมีอะไรก็นัดตาบัค นี่จะค้านก็ไม่ได้เพราะมีปหคนเดียว,ไม่กินกาแฟเลยไม่ชอบบรรยากาศสีตาบัค คือนั่งอะนั่งได้แต่ไม่ค่อยจอยาเพราะมีแต่กลิ่นกาแฟ ละเพื่อนคือมีอะไรก็นัดตาบัค นี่จะค้านก็ไม่ได้เพราะมีปีเดียว
หรือว่า Toyota Altis 2019 ใหม่ จะมีหน้าตาเป็นแบบนี้...,ถือว่า Toyota Altis 2019 ใหม่ จะมีหน้าตาเป็นแค่นี้.
เลื่อนสอบ GAT/PAT เพราะตรงวันเลือกตั้ง แล้ว #เลื่อนเลือกตั้ง อีกครั้ง...คงยิ่งทำให้เด็กรุ่นใหม่มีความทรงจำแย่ๆกับการเมืองมากขึ้น #dek62 #เลื่อนแม่มึงสิ,เลื่อนสอบ GAT/PAT เพราะตรงวันเลือกตั้ง แล้ว #เลื่อนเลือกตั้ง อีกครั้ง.คงยิ่งทำให้เด็กรุ่นใหม่มีความทรงจำแย่ๆๆกับการเมืองมือขึ้น #dek62 #เลื่อนแม่มึงสิ
มีนิสสันเซลฟี่ไหมครับ,มีนิกสันเยลลี่ไหมครับ
มิตซู ปาเจโร่ รุ่นใหม่แหง่,มิติ ปาเจโร่ รุ่นใหม่แหง่
ป่ะ ไปคลายหนาว ทิ้งความเครียด กับดนตรีด้วยกัน พักสมอง มองภูเขา ดูทะเลหมอก #แสงโสม ที่บ้านคือแฟนพันธ์ุแท้ แสงโสม555,ป่ะ ไปคลายหนาว ทิ้งความเครียด กับดนตรีด้วยกัน พักสมอง มองภูเขา ดูทะเลหมอก #แสงสี ที่บ้านคือแฟนพันธ์สุแท้ แสงสี5
ผ้าอนามัยค่ะ ส่วนมากตอนนี้ ที่ รพ จะใช้ตอนคลอดลูก เพราะ มันสะดวกกว่าใส่แบบแปะเกงในค่ะ,ผ้าอนามัยค่ะ ส่วนมากตอนนี้ ที่ รพ จะใช้ตอนคลอดลูก เพราะ มันสะดวกกว่าใส่แบบแปะเกลงในค่ะ
สวัสดีคับ,สวัสดีคับ
จริงเมาเบียร์ช้างอุดหนุนเขามาตลอด,จริงเมาเบียร์ช้างอุดหนุนเขามาตลอด
กำลังร้บชมยุ่จ้า,กำลังร้บชมยุ่จ้า
งั้นเจ้าเลี้ยง ตามนี้นะ เจ้าค่าาา,งั้นเจ้าเลี้ยง ตามนี้นะ เจ้าค่า
เกลียดกาวผ้าอนามัยไม่ติดเหี้ยไรซักอย่างเป็นกาวที่กากมากเว่อร์ ต่อไปนี่ควรแถมกาวสองหน้ามาด้วยนะ 😒,เกลียดกาวผ้าอนามัยไม่ติดเหี้ยไรซักอย่างเป็นกาวที่กากมากเว่อร์ ต่อไปนี่ควรแถมกาวกองหน้ามาด้วยนะ 😒
คันนี้สิ ใช่เลย! ฮอนด้า ซีวิค แฮทซ์แบ็ก ใหม่ แนวนอนแถวที 5 คันที่ 4 ค่าา ❤ คอนเฟิร์มค่ะ จาก #สาวกคนรักฮอนด้า👍👍👍❤❤❤ #EnjoyHondaThailand,คันนี้สิ ใช่เลย! แพนด้า ซิวิค แฮทซ์แบ็ก ใหม่ แนวนอนแถวที 5 คันที่ 4 ค่ามา ❤ คอนเฟิร์มค่ะ จาก #สาวกคนรักแพนด้า👍❤ #EnjoyHondaThailand
สาสสสส พูดเรื่องเงินแล้วปวดใจชิบ,สาสี พูดเรื่องเงินแล้วปวดชิบ
รุ่นนี้หรือเปล่าครับ Honda Pilot ใหญ่กว่า Crv มีขายในอเมริกาครับ จัดอยู่ในระดับเดียวกับ Mazda CX-9 ครับ,รุ่นนี้หรือเปล่าครับ Honda Pilot ใหญ่กว่า Crv มีขายในอเมริกาครับ จัดอยู่ในระดับเดียวกับ Mazda CX-9 ครับ
ไม่ว่าจะเม้นท์ไหนๆ ก็เป็นเสียงเดียวกันว่า เน็ตตัดบ่อยโคตร บางวันแม่งตัด 7-8 รอบ ไอห่า กุจะสตรีม จะอัพโหลดอะไร ก็ไม่ได้ ต้องมาคอยระแวงว่าแม่งจะตัดเมื่อไหร่ ต้องมา resume ตอนไหน,ไม่ว่าจะเม้นท์ไหนๆๆ ก็เป็นเสียงเดียวกันว่า เน็ตตัดบ่อยโคตร บางวันที่ลงตัด 7-8 รอบ ไอห่า กุจะสตรีม จะอัพโหลดอะไร ก็ไม่ได้ ต้องมาคอยระแวงว่าแม่ลงจะตัดเมื่อไหร่ ต้องมา resume ตอนไหน
สีจะแพงกว่าค่ากิน5556,สีจะแพงกว่าค่ากิน56
คูปองที่ให้มาไม่สามารถใช้ได้หลายใบต่อ1ใบเสร็จหราคะ ไม่ใช่เมนูเดียวกันนะคะ พอดีใช้คูปองติ่มซำ1แถม1ไปแต่จะใช้น้ำแตงโมปั่น1แถม1ไม่ได้ค่ะ,คูปองที่ให้มาไม่สามารถใช้ได้หลายใบต่อ1ใบเสร็จหราคะ ไม่ใช่เมนูเดียวกันมะคะ พอดีใช้คูปองติ่ม1แถม1ไปแต่จะใช้น้ำแต้มปั่น1แถม1ไม่ได้ค่ะ
สู้ซีวิคก็ไม่ได้ กระแทกนิดหน่อย แตกทั้งซ้ายขวา จ่ายไปดิค่าถุงลม555มึนถุงลมกระแทกความจำเสื่อมยุครึ่งชั่วโมง55แต่ก็ยังทำงานแหละวะ,สู้ซิวิคก็ไม่ได้ กระแทกนิดหน่อย แตกทั้งซ้ายขวา จ่ายไปดิค่าถุงลม5มึนถุงลมกระแทกความจำเสื่อมยุครึ่งชั่วโมง55แต่ก็ยังทำงานแหละวะ
ตอนนี้กำลังรอสั่งอาหาร ไม่มีเจ้าหน้าที่มารับออเดอร์ ไม่สนใจ ทำเหมือนเราเป็นอากาศ คนมาทีหลัง ได้กินสบายใจ เป็นแฟนคลับก้อน แต่เจอแบบนี้ เลิกทานแน่นอนค่ะ #สาขาโลตัสแคราย 4/2/61,ตอนนี้กำลังรอสั่งอาหาร ไม่มีเจ้าหน้าที่มารับเดอร์ ไม่สนใจ ทำเหมือนเราเป็นอากาศ คนมาทีหลัง ได้กินสบายใจ เป็นแฟนคลับก้อน แต่เจอแค่นี้ เลิกทานแน่นอนค่ะ #สาขาโลตัสแคราย 4/2/61
☹️,☹️
กด love ❤️ ชอบความเรียบง่ายของ SPY Cooler ค่ะ ไม่ว่าปาร์ตี้งานไหนๆ อยากจัดแอลกอฮอล์แบบเบาๆต้องนี่เลย SPY นี่ล่ะใช่เลยตอบโจทย์🍾 รสชาติเบาๆ ละมุน แอลกอฮอล์ไม่มากดื่มได้เรื่อยๆ สังสรรค์กันได้เต็มที่ จะนั่งคุย ร้องเพลง หรือรับลมเย็นๆ จิบ SPY ไปด้วยก็ฟินสุดๆไปเลยค่ะ🏖,กด love ❤️ ชอบความเรียบง่ายของ SPY Cooler ค่ะ ไม่ว่าปาร์ตี้งานไหนๆๆ อยากจัดแอลกอฮอล์แบบเบาๆๆต้องนี่เลย SPY นี่ล่ะใช่เลยตอบโจทย์🍾 รสชาติเบาๆๆ ละมุน แอลกอฮอล์ไม่มากดื่มได้เรื่อย สังสรรค์กันได้เต็มที่ จะนั่งคุย ร้องเพลง หรือรับเย็นๆๆ จิบ SPY ไปด้วยก็ฟินสุดๆๆไปเลยค่ะ🏖
